REC.1403B;We need to wait for how many years exactly?;Nous ne sommes à plus à quelques années près...;;;;;;;;;;;;x
REC.1404;Cargo for ransom;Cargaison rançonnée;;;;;;;;;;;;x
DESCREC.1404;A cargo of stone blocks due for the construction of our Cathedral has been intercepted by bandits whom demand ransom. We have to pay to get it back if we do not want to suffer too much delay on site.;Une cargaison de blocs de pierre destinée au chantier de notre Cathédrale a été interceptée par des brigands qui nous en demande rançon. Il nous faut payer pour la récupérer si nous ne voulons souffrir trop de retard sur le chantier.;;;;;;;;;;;;x
REC.1404A;Immediate payment is our only solution ...;Dans l'immédiat payer est notre seule solution...;;;;;;;;;;;;x
REC.1404B;So much for that one. Make sure you escort the next one.;Tant pis pour celle-ci. Veillez à ce qu'on fasse escorter les prochaines.;;;;;;;;;;;;x
REC.1405;Surcoût (AR) défaut de conception;Surcoût (AR) défaut de conception;;;;;;;;;;;;x
DESCREC.1405;If you ever had doubts about the competence of your architect, here is some news that will not reassure you. It seems that some parts of the Cathedral strucutre show weaknesses and flaws. Is this not the work of someone who is trying to reduce the cost of the work.;Si jamais vous aviez quelques déjà doutes sur les compétences de votre architecte, voici des nouvelles qui ne vont pas vous rassurer. Il semblerait que certaines structures de la Cathédrale montrent des faiblesses et des défauts. Ce n'est pas ça qui va alléger le coût des travaux.;;;;;;;;;;;;x
REC.1405A;Note to self: "choose a better architect";Note pour plus tard : "mieux choisir son architecte";;;;;;;;;;;;x
REC.1406;Surely (AR) the cost has been underestimated;surcoût (AR) coût mésestimé;;;;;;;;;;;;x
DESCREC.1406;Our Architect seems to be not a kindred spirit to clarity and evidence, his last cost estimates reveal themselves to be greatly disconnected with reality. It will cost us more than expected.;Notre architecte ne semble pas être un esprit des plus éclairés et pour preuve, ses dernières estimations des coûts se sont révélées grandement en dessous de la réalité. Cela va nous coûter plus cher que prévu.;;;;;;;;;;;;x
REC.1406A;Argh...!;Argh...!;;;;;;;;;;;;x
REC.1407;Unscrupulous suppliers v2;Fournisseurs peu scrupuleux v2 ;;;;;;;;;;;;x
DESCREC.1407;One of our suppliers of stone for the construction of the Cathedral, appeared this morning to post an increase in the rates -crisis obliges it - it seems ...;Un de nos fournisseurs de pierres pour la construction de la Cathédrale, s'est présenté ce matin pour nous soumettre une augmentation de ces tarifs -crise oblige paraît-il-,...;;;;;;;;;;;;x
REC.1407A;Arrestez! He takes me for a ham-sandwitch? Heave him to the field!;Stop ! Il me prend pour un jambon ? Virez-le sur le champs !;;;;;;;;;;;;x
#;;x;;;;;;;;;;;;x
REC.1408;pre-proposal loan;pré-proposition emprunt;;;;;;;;;;;;x
DESCREC.1408;Rumors of the construction of our Cathedral is spreading to all and all and have reached the ears of loan sharks that come to offer their loan services to accelerate the funding of the construction.;Les rumeurs de la construction de notre Cathédrale se répand de plus en plus et sont venues à l'oreille d'usuriers qui viennent nous proposer leurs services de prêts pour accélérer le financement du chantier.;;;;;;;;;;;;x
REC.1408A;Let's see what you have to offer me ... (usury is a sin?);Voyons ce que vous avez à me proposer... (l'usure est un péché ? );;;;;;;;;;;;x
usure1;Usury is a sin? \n;L'usure est un péché ? \n;;;;;;;;;;;;x
REC.1408B;Not for now.;Pas pour le moment.;;;;;;;;;;;;x
usure2;I'll think about it for a while.;Je vais y réfléchir pendant un temps.;;;;;;;;;;;;x
REC.1408C;Not in your life! Get out!;Jamais de la vie ! Sortez !;;;;;;;;;;;;x
usure3;Usury is a sin!\n;L'usure est un péché !\n;;;;;;;;;;;;x
REC.1409;Loans at 3%;Prêts à 3%;;;;;;;;;;;;x
DESCREC.1409;With regard to your income, here are the sums we can lend you.\nThe interest rate is 3% and the duration is 10 years.;Au regard de nos revenus, voici les sommes que nous pouvons vous prêter.\nLe taux d'intérêt est de 3% et la durée est de 10ans.;;;;;;;;;;;;x
REC.1409A;Moneylenders have cancelled in light of our revenue. The filth!;Les usuriers ont renoncé au vu de nos revenus. Les ordures !;;;;;;;;;;;;x
REC.1409B;Borrow 150 ducats. 18 ducats annual interest;Emprunter 150 ducats. Remboursement annuel 18 ducats;;;;;;;;;;;;x
REC.1409C;Borrow 250 ducats. 30 ducats annual interest;Emprunter 250 ducats. Remboursement annuel 30 ducats;;;;;;;;;;;;x
REC.1409D;Borrow 350 ducats. 42 ducats annual interest;Emprunter 350 ducats. Remboursement annuel 42 ducats;;;;;;;;;;;;x
REC.1409E;Borrow 450 ducats. 54 ducats annual interest;Emprunter 450 ducats. Remboursement annuel 54 ducats;;;;;;;;;;;;x
REC.1409F;Not very interesting. I decline your offers.;Pas très intéressant. Je décline vos offres.;;;;;;;;;;;;x
REC.1410;Loans at 4%;Prêts à 4%;;;;;;;;;;;;x
DESCREC.1410;With regard to your income, here are the sums we can lend you.\nThe interest rate is 3% and the duration is 10 years.;Au regard de nos revenus, voici les sommes que nous pouvons vous prêter.\nLe taux d'intérêt est de 4% et la durée est de 10ans.;;;;;;;;;;;;x 
REC.1410A;Moneylenders have cancelled in light of our revenue. The filth!;Les usuriers ont renoncé au vu de nos revenus. Les ordures !;;;;;;;;;;;;x
REC.1410B;Borrow 150 ducats. 19 ducats annual interest;Emprunter 150 ducats. Remboursement annuel 19 ducats;;;;;;;;;;;;x
REC.1410C;Borrow 250 ducats. 32 ducats annual interest;Emprunter 250 ducats. Remboursement annuel 32 ducats;;;;;;;;;;;;x
REC.1410D;Borrow 350 ducats. 45 ducats annual interest;Emprunter 350 ducats. Remboursement annuel 45 ducats;;;;;;;;;;;;x
REC.1410E;Borrow 450 ducats. 57 ducats annual interest;Emprunter 450 ducats. Remboursement annuel 57 ducats;;;;;;;;;;;;x
REC.1410F;Not very interesting. I decline your offers.;Pas très intéressant. Je décline vos offres.;;;;;;;;;;;;x
REC.1410G;Is this truly all you have to offer?;Est-ce vraiment tout ce que vous avez à proposer ?;;;;;;;;;;;;x
usure4;Seek to renegotiate the interest rate;Chercher à renégocier le taux d'intérêt.;;;;;;;;;;;;x
REC.1411;Loans at 5%;Prêts à 5%;;;;;;;;;;;;x
DESCREC.1411;With regard to your income, here are the sums we can lend you.\nThe interest rate is 3% and the duration is 10 years.;Au regard de nos revenus, voici les sommes que nous pouvons vous prêter.\nLe taux d'intérêt est de 5% et la durée est de 10ans.;;;;;;;;;;;;x
REC.1411A;Moneylenders have cancelled in light of our revenue. The impiety!;Les usuriers ont renoncé au vu de nos revenus. Les impies !;;;;;;;;;;;;x
REC.1411B;Borrow 150 ducats. 20 ducats annual interest;Emprunter 150 ducats. Remboursement annuel 20 ducats;;;;;;;;;;;;x
REC.1411C;Borrow 250 ducats. 34 ducats annual interest;Emprunter 250 ducats. Remboursement annuel 34 ducats;;;;;;;;;;;;x
REC.1411D;Borrow 350 ducats. 47 ducats annual interest;Emprunter 350 ducats. Remboursement annuel 47 ducats;;;;;;;;;;;;x
REC.1411E;Borrow 450 ducats. 60 ducats annual interest;Emprunter 450 ducats. Remboursement annuel 60 ducats;;;;;;;;;;;;x
REC.1411F;Not very interesting. I decline your offers.;Pas très intéressant. Je décline vos offres.;;;;;;;;;;;;x
REC.1411G;Anything better ?;Vous n'avez rien de mieux ?;;;;;;;;;;;;x
#;;x;;;;;;;;;;;;x
REC.1420;Loans;RMB emprunts;;;;;;;;;;;;x
DESCREC.1420;As on time as a helvetian cuckoo clock, usurers come claiming their annual refund and interests.;Réglés comme des coucous helvètes, nos prêteurs nous réclament le paiement de l'annuité majorée des intérêts pour cette année.;;;;;;;;;;;;x
REC.1420A1;Never late, nor ever early...;Jamais en retard les bougres  !;;;;;;;;;;;;x
REC.1420A2;The ultimate instalment. At last !;Enfin le dernier versement !;;;;;;;;;;;;x
REC.1420B1;Can't they forget me once ?;Ils ne m'oublient donc jamais ?;;;;;;;;;;;;x
REC.1420B2;The ultimate instalment. At last !;L'ultime versement. Enfin !;;;;;;;;;;;;x
REC.1420C1;Never late, nor ever early...;Jamais en retard les bougres...;;;;;;;;;;;;x
REC.1420C2;The ultimate instalment. At last !;L'ultime versement. Enfin !;;;;;;;;;;;;x
REC.1420D1;Never late, nor ever early...;Jamais en retard les bougres...;;;;;;;;;;;;x
REC.1420D2;The ultimate instalment. At last !;L'ultime versement. Enfin !;;;;;;;;;;;;x
REC.1420E1;Never late, nor ever early...;Jamais en retard les bougres...;;;;;;;;;;;;x
REC.1420E2;The ultimate instalment. At last !;L'ultime versement. Enfin !;;;;;;;;;;;;x
REC.1420F1;Never late, nor ever early...;Jamais en retard les bougres...;;;;;;;;;;;;x
REC.1420F2;The ultimate instalment. At last !;L'ultime versement. Enfin !;;;;;;;;;;;;x
REC.1420G1;Never late, nor ever early...;Jamais en retard les bougres...;;;;;;;;;;;;x
REC.1420G2;The ultimate instalment. At last !;L'ultime versement. Enfin !;;;;;;;;;;;;x
REC.1420H1;Never late, nor ever early...;Jamais en retard les bougres...;;;;;;;;;;;;x
REC.1420H2;The ultimate instalment. At last !;L'ultime versement. Enfin !;;;;;;;;;;;;x
REC.1420I1;Never late, nor ever early...;Jamais en retard les bougres...;;;;;;;;;;;;x
REC.1420I2;The ultimate instalment. At last !;L'ultime versement. Enfin !;;;;;;;;;;;;x
REC.1420J1;Never late, nor ever early...;Jamais en retard les bougres...;;;;;;;;;;;;x
REC.1420J2;The ultimate instalment. At last !;L'ultime versement. Enfin !;;;;;;;;;;;;x
REC.1420K1;Never late, nor ever early...;Jamais en retard les bougres...;;;;;;;;;;;;x
REC.1420K2;The ultimate instalment. At last !;L'ultime versement. Enfin !;;;;;;;;;;;;x
REC.1420L1;Never late, nor ever early...;Jamais en retard les bougres...;;;;;;;;;;;;x
REC.1420L2;The ultimate instalment. At last !;L'ultime versement. Enfin !;;;;;;;;;;;;x
REC.1421;Death of a debt;Mort d'un endetté;;;;;;;;;;;;x
DESCREC.1421;I died leaving the debt to my heir;Je suis mort en laissant une dette à mon héritier.;;;;;;;;;;;;x
REC.1421A;This will be for my heir to deal with;Ce sera à mon héritier de s'en occuper;;;;;;;;;;;;x
TOOLTIPREC.1421A;Loaners will visit my heir soon;Les prêteurs vont bientôt rendrent visite à mon héritier;;;;;;;;;;;;x
REC.1422;Visit lenders;Visite des prêteurs;;;;;;;;;;;;x
DESCREC.1422;The lenders present their condolences. \nHowever they want you to pay your predecessor's loan. \nIn their kindless they have extended the contract a year;Les prêteurs vous présentent leur condoléances. \nCependant ils désirent que vous remboursiez l'emprunt contracté par votre prédecesseur.\nDans leur grande bonté, ils décalent les échéances à pile dans une année.;;;;;;;;;;;;x
REC.1422A;I will honor the loan;Je vais honorer l'emprunt;;;;;;;;;;;;x
REC.1422B;Request a period of 5 years before the next deadline;Demander un délai de 5 ans avant la prochaine échéance;;;;;;;;;;;;x
REC.1422C;What loan?;Quel emprunt ?;;;;;;;;;;;;x
TOOLTIPREC.1422C;No one will lend you money after your refusal to pay;Plus personne ne vous prêtera de l'argent après ce refus de payer;;;;;;;;;;;;x
REC.2001;Jealous cousins;Voisins jaloux;;;;;;;;;;;;x
DESCREC.2001;One of our neighbors has embarked on the construction of a cathedral with a relic.\nThe cathedral begins to take shape and makes you jealous.\nShould you as you embark on the construction of a cathedral even with a fake relic?;Un de nos voisins s'est lancé dans la construction d'une cathédrale grâce à une relique.\nLa cathédrale commence à prendre forme et à vous rendre jaloux.\nDevez vous vous lancez vous aussi dans la construction d'une cathédrale même avec une fausse relique ?;;;;;;;;;;;;x
REC.2001A;Do not wait a second, falsify us a relic;Il ne faut pas attendre une seconde, falsifions une relique;;;;;;;;;;;;x
REC.2001B;I must not do so for reasons of honour;Je ne dois pas être fait pour un tel honneur;;;;;;;;;;;;x
TOOLTIPREC.2001A;The §Ydecision§! build a cathedral has become available \n;La §Ydécision§! pour construire une cathédrale devient disponible\n;;;;;;;;;;;;x
REC.2004;;Faire un coup bas;;;;;;;;;;;;x
DESCREC.2004;;Vous réflechissez à une manière de mettre des bâtons dans les roues (de construction) à un autre bâtisseur de cathédrale, en l'occurence à un co-vassal;;;;;;;;;;;;x
REC.2004A;;Non, cela ne plairait pas à Dieu;;;;;;;;;;;;x
TOOLTIPREC.2004B;;Une bonne compétence en §Yintendance§! serait préférable pour mener à bien le coup bas\n;;;;;;;;;;;;x
TOOLTIPREC.2004C;;Une bonne compétence en §Ymartial§! serait préférable pour mener à bien le coup bas\n;;;;;;;;;;;;x
TOOLTIPREC.2004D;;Une bonne compétence en §Yconnaissance§! serait préférable pour mener à bien le coup bas\n;;;;;;;;;;;;x
REC.2004B;;Soudoyez certains membres du chantier;;;;;;;;;;;;x
REC.2004C;;Massacrez certains membres du chantier;;;;;;;;;;;;x
REC.2004D;;Effrayez certains membres du chantier avec des malédictions;;;;;;;;;;;;x
REC.20041;;Faire un coup bas;;;;;;;;;;;;x
DESCREC.20041;;Vous réflechissez à une manière de mettre des bâtons dans les roues (de construction) à un autre bâtisseur de cathédrale, en l'occurence à un voisin;;;;;;;;;;;;x
REC.20041B;;Faisons un coup bas à ce voisin;;;;;;;;;;;;x
EVTTOOLTIPREC.2004A;;Coup bas est un succès et reste anonyme;;;;;;;;;;;;x
EVTTOOLTIPREC.2004B;;Coup bas est un succès mais identité dévoilée;;;;;;;;;;;;x
EVTTOOLTIPREC.2004C;;Coup bas est un échec mais reste anonyme;;;;;;;;;;;;x
EVTTOOLTIPREC.2004D;;Coup bas est un échec et identité dévoilée;;;;;;;;;;;;x
REC.2009;;Compte-rendu du coup bas;;;;;;;;;;;;x
DESCREC.2009;;Le coup bas est un succès et mon nom n'a pas été divulgué.;;;;;;;;;;;;x
REC.2009A;;C'est une réussite totale;;;;;;;;;;;;x
REC.2010;;Compte-rendu du coup bas;;;;;;;;;;;;x
DESCREC.2010;;Le coup bas est un succès mais mon nom a été divulgué sous la torture.;;;;;;;;;;;;x
REC.2010A;;Je dois m'attendre à en subir les conséquences;;;;;;;;;;;;x
REC.2011;;Compte-rendu du coup bas;;;;;;;;;;;;x
DESCREC.2011;;Le coup bas est un échec mais mon nom n'a pas été divulgué.;;;;;;;;;;;;x
REC.2011A;;Au moins ces minables n'ont pas avoué;;;;;;;;;;;;x
REC.2012;;Compte-rendu du coup bas;;;;;;;;;;;;x
DESCREC.2012;;Le coup bas est un échec et mon nom a été divulgué sous la torture.;;;;;;;;;;;;x
REC.2012A;;Je dois m'attendre à en subir les conséquences;;;;;;;;;;;;x
REC.2013;;Réaction au coup bas dévoilé;;;;;;;;;;;;x
DESCREC.2013;;Un coup bas a été intenté contre la construction de ma cathédrale. \nAprès avoir soumis à la question, je connais le nom du coupable.;;;;;;;;;;;;x
REC.2013A;;Je vais lui rendre la monnaie de sa pièce;;;;;;;;;;;;x
REC.2013B;;Je lui pardonne, puisse Dieu en faire autant;;;;;;;;;;;;x
REC.2014;;Réaction au coup bas non dévoilé;;;;;;;;;;;;x
DESCREC.2014;;Un coup bas a été intenté contre la construction de ma cathédrale. \nJe n'ai pas réussi à connaître le nom du coupable.;;;;;;;;;;;;x
REC.2014A;;C'est surement ce voisin qui me fait de l'ombre avec sa cathédrale;;;;;;;;;;;;x
REC.2014B;;C'est surement ce co-vassal qui me fait de l'ombre avec sa cathédrale;;;;;;;;;;;;x
REC.2014C;;Je lui pardonne, puisse Dieu en faire autant;;;;;;;;;;;;x
DESCREC.2018;;Une relique qui m'est inutile se trouve sur mon domaine. \nJe pourrais la vendre, cela me serait plus utile.;;;;;;;;;;;;x
REC.2018A;;Vendre une relique inutile;;;;;;;;;;;;x
REC.2018B;;Garder la relique;;;;;;;;;;;;x
DESCREC.2019;;Pour batir une cathédrale, il me faut apparement une relique. \nJe dois en acheter une à fort prix à un marchand ou sinon payer seulement la moitié pour une relique mineure à mon vassal le prêtre si j'en trouve une avec lui dans sa crypte.;;;;;;;;;;;;x
REC.2019A;;Chercher dans la crypte une relique mineure avec ce prêtre;;;;;;;;;;;;x
TOOLTIPREC.2019A;;J'espère que cela ne sera pas trop ennuyeux;;;;;;;;;;;;x
REC.2019B;;Acheter cette relique authentifiée par Rome au marchand;;;;;;;;;;;;x
TOOLTIPREC.2019B;;Je vais mettre cette relique sur une province de mon domaine\n;;;;;;;;;;;;x
REC.2019C;;Acheter cette relique d'origine forte douteuse au marchand;;;;;;;;;;;;x
TOOLTIPREC.2019C;;Je vais mettre cette relique sur une province de mon domaine. \nEspérons qu'elle ne pose pas de problème par la suite.\n;;;;;;;;;;;;x
DESCREC.2021;;Après une journée passée dans la crypte, j'ai réussi avec le prêtre à mettre la main sur une relique mineure. \nComme convenu je m'en suis emparé pour la grâce de Dieu pour la modique somme de 50 ducats.;;;;;;;;;;;;x
REC.2021A;;Je vais pouvoir construire une cathédrale;;;;;;;;;;;;x
DESCREC.2022;;Cette journée passée dans la crypte avec le prêtre fut horrible. \nNon seulement je n'ai pas pu mettre la main sur une relique mais en plus le prêtre était de forte mauvaise compagnie.\n;;;;;;;;;;;;x
REC.2022A;;Je dois cherchez une relique ailleurs;;;;;;;;;;;;x
TOOLTIPREC.2022A;;Je vais voir avec un autre prêtre ou le marchand\n;;;;;;;;;;;;x
DESCREC.2023;;Un cardinal, envoyé par Rome pour authentifié ma relique livre ses conclusions. \nIl s'avère que celle-ci est fausse. \nJ'échappe de peu à l'excommunication.;;;;;;;;;;;;x
REC.2023A;;La fausse relique a fait un vrai miracle.;;;;;;;;;;;;x
DESCREC.2025;;Vous avez construit l'une des premières cathédrales au monde.;;;;;;;;;;;;x
REC.2025A;;J'ai construit la 1ère;;;;;;;;;;;;x
REC.2025B;;J'ai construit la 2ème;;;;;;;;;;;;x
REC.2025C;;J'ai construit la 3ème;;;;;;;;;;;;x
REC.2025D;;J'ai construit la 4ème;;;;;;;;;;;;x
REC.2025E;;J'ai construit la 5ème;;;;;;;;;;;;x
REC.2025F;;J'ai construit la 6ème;;;;;;;;;;;;x
REC.2025G;;J'ai construit la 7ème;;;;;;;;;;;;x
REC.2025H;;J'ai construit la 8ème;;;;;;;;;;;;x
REC.2025I;;J'ai construit la 9ème;;;;;;;;;;;;x
REC.2025J;;J'ai construit la 10ème;;;;;;;;;;;;x
NAMEREC.2026;;Cathédrale construite;;;;;;;;;;;;x
DESCREC.2026;;On vient de finir de construire une cathédrale. \nDes bâtisseurs ont réussi à bâtir une impressionnante maison du Seigneur connue dans tout le monde Chrétien. Les généreux donnateurs de cet édifice iront directement au paradis. En attendant, sur Terre, ils deviennent des exemples;;;;;;;;;;;;x
REC.2026A;;C'est la 1ère;;;;;;;;;;;;x
REC.2026B;;C'est la 2ème;;;;;;;;;;;;x
REC.2026C;;C'est la 3ème;;;;;;;;;;;;x
REC.2026D;;C'est la 4ème;;;;;;;;;;;;x
REC.2026E;;C'est la 5ème;;;;;;;;;;;;x
REC.2026F;;C'est déjà la 6ème;;;;;;;;;;;;x
REC.2026G;;C'est déjà la 7ème;;;;;;;;;;;;x
REC.2026H;;C'est déjà la 8ème;;;;;;;;;;;;x
REC.2026I;;C'est déjà la 9ème;;;;;;;;;;;;x
REC.2026J;;C'est déjà la 10ème;;;;;;;;;;;;x
DESCREC.2101;;Un sculpteur s'est fait remarqué sur votre chantier. Ce qu'il peut faire avec la pierre est à couper le souffle.\n Il va peut-être vous demander audience afin de réaliser des œuvres grandioses.;;;;;;;;;;;;x
REC.2101A;;Je suis content qu'il soit sur mon chantier;;;;;;;;;;;;x
sculpteur_repere;;Un sculpeur apparaît dans votre cour;;;;;;;;;;;;x
DESCREC.2102;;Un sculpteur de votre cour vous sollicite pour financer la création d'une petite sculpture qui devrait être magnifique.;;;;;;;;;;;;x
REC.2102A;;Je vais financer ce chef d'œuvre;;;;;;;;;;;;x
EVTTOOLTIPREC.2102A;;Le sculpteur se met au travail;;;;;;;;;;;;x
REC.2102B;;Lui dire de repasser l'an prochain;;;;;;;;;;;;x
EVTTOOLTIPREC.2102B;;Le sculpteur s'en va et ne manquera pas de revenir;;;;;;;;;;;;x
REC.2102C;;Ce serai gaspiller de l'argent;;;;;;;;;;;;x
DESCREC.2104;;Votre sculpteur vous présente sa réalisation.\n Tous les gens autour de vous sont en émoi, même la brute du village se met à pleurer devant une telle beauté.;;;;;;;;;;;;x
REC.2104A;;J'aime sa sculpture;;;;;;;;;;;;x
DESCREC.2105;;Votre sculpteur vous présente sa réalisation.\n Les gens autour de vous sont partagés. Certains l'aiment mais d'autres trouvent qu'elle est somme toute banale.;;;;;;;;;;;;x
REC.2105A;;J'accepte la sculpture mais il devra refaire ses preuves.;;;;;;;;;;;;x
sculpteur_retour_base;;Le sculpteur va faire des travaux plus simple avant de revenir à la charge avec une nouvelle idée de chef d'œuvre.;;;;;;;;;;;;x
REC.2105B;;Je vais lui donner l'occasion de faire mieux;;;;;;;;;;;;x
REC.2105C;;Je ne veux plus qu'il sculpte d'œuvres;;;;;;;;;;;;x
DESCREC.2106;;Votre sculpteur vous présente sa réalisation.\n Tous les gens autour de vous sont effarés devant la laideur du résultat. Même l'aveugle du village trouve cela moche.;;;;;;;;;;;;x
REC.2106A;;Je vais lui donner l'occasion de faire mieux;;;;;;;;;;;;x
REC.2106B;;Je ne veux plus qu'il sculpte d'œuvres;;;;;;;;;;;;x
REC.2106C;;Qu'on l'emprisonne;;;;;;;;;;;;x
DESCREC.2107;;Un sculpteur de votre cour vous sollicite pour financer la création d'une sculpture de taille moyenne qui devrait être magnifique.;;;;;;;;;;;;x
DESCREC.2108;;Un sculpteur de votre cour vous sollicite pour financer la création d'une grande sculpture qui devrait être magnifique.;;;;;;;;;;;;x
DESCREC.2110;;Une rumeur d'un autre comté fait état d'une splendide sculpture réalisée pour une cathédrale.;;;;;;;;;;;;x
REC.2110A;;Envoyer un faux voyageur pour aller y voir de plus près.;;;;;;;;;;;;x
REC.2110B;;D'autres choses me préoccupent davantage pour le moment.;;;;;;;;;;;;x
REC.2110C;;Je n'ai que faire des sculptures.;;;;;;;;;;;;x
EVTTOOLTIPREC.2110A;;Le faux voyageur partira enqueter;;;;;;;;;;;;x
DESCREC.2111;;Le faux voyageur que vous avez envoyé il y a environ 2 ans est de retour.;;;;;;;;;;;;x
REC.2111A;;La rumeur était infondée, la sculpture n'a rien d'un chef d'œuvre.;;;;;;;;;;;;x
DESCREC.2113;;Le faux voyageur que vous avez envoyé il y a longtemps a pris contact avec le sculpteur ayant réalisé le chef d'œuvre.\n Quel ordre lui avez-vous transmis ?;;;;;;;;;;;;x
REC.2113A;;Soudoyer des gens importants pour qu'il ne sculpte plus rien de bien.;;;;;;;;;;;;x
REC.2113B;;Soudoyer le sculpteur pour qu'il vienne sculpter pour vous.;;;;;;;;;;;;x
REC.2113C;;Tuer le sculpteur.;;;;;;;;;;;;x
REC.2113D;;Aucun, il ne va pas aller plus loin.;;;;;;;;;;;;x
DESCREC.2122;;Mon faux voyageur a réussi, le sculpteur ne sculptera plus rien de bien pour notre rival.\n De plus notre rival ignore qui est derrière tout cela;;;;;;;;;;;;x
REC.2122A;;Le subterfuge du faux voyageur a marché à merveille.;;;;;;;;;;;;x
DESCREC.2123;;Mon faux voyageur a réussi, le sculpteur ne sculptera plus rien de bien pour notre rival.\n Mais notre rival sait que l'on est derrière tout cela;;;;;;;;;;;;;x
REC.2123A;;Je dois m'attendre à en subir les conséquences;;;;;;;;;;;;x
DESCREC.2124;;Mon faux voyageur a échoué, mais il n'a pas divulgué mon nom sous la torture.;;;;;;;;;;;;x
REC.2124A;;Au moins il n'a pas parlé;;;;;;;;;;;;x
DESCREC.2125;;Mon faux voyageur a échoué et il a pas divulgué mon nom sous la torture.;;;;;;;;;;;;x
REC.2125A;;Je dois m'attendre à en subir les conséquences;;;;;;;;;;;;x
DESCREC.2126;;Mon faux voyageur a réussi, le sculpteur a rejoint ma cour et mon rival ignore où il est parti;;;;;;;;;;;;x
REC.2126A;;Le subterfuge du faux voyageur a marché à merveille.;;;;;;;;;;;;x
DESCREC.2127;;Mon faux voyageur a réussi, le sculpteur a rejoint ma cour mais mon rival sait qu'il est à ma cour;;;;;;;;;;;;x
REC.2127A;;Je dois m'attendre à en subir les conséquences;;;;;;;;;;;;x
DESCREC.2128;;Mon faux voyageur a réussi, le sculpteur n'est plus et tout le monde ignore qui est derrière cela;;;;;;;;;;;;x
REC.2128A;;Le subterfuge du faux voyageur a marché à merveille.;;;;;;;;;;;;x
DESCREC.2129;;Mon faux voyageur a réussi, le sculpteur n'est plus mais le faux voyageur a divulgué mon nom sous la torture;;;;;;;;;;;;x
REC.2129A;;Je dois m'attendre à en subir les conséquences;;;;;;;;;;;;x
DESCREC.2130;;Sous le règne de leur précédent seigneur, de nombreux sculpteurs se sont vus interdire de sculpter de coûteux chef d'œuvres. Voulez-vous les y autoriser de nouveau ?;;;;;;;;;;;;x
REC.2130A;;Autoriser les sculpteurs à resculpter;;;;;;;;;;;;x
REC.2130B;;Ne pas les autoriser à resculpter;;;;;;;;;;;;x
DESCREC.2131;;Après la réalisation d'une immense sculpture de toute beauté, un maître sculpteur souhaite fonder une guilde de sculpteur.;;;;;;;;;;;;x
REC.2131A;;Bien sûr, j'en suis ravi;;;;;;;;;;;;x
REC.2131B;;Non, je ne veux plus voir de sculpteurs ici une fois la cathédrale finie;;;;;;;;;;;;x
DESCREC.2132;;A qui vais-je offrir une sculpture ?;;;;;;;;;;;;x
REC.2132A;;A son chef religieux;;;;;;;;;;;;x
TOOLTIPRECAUCUNEFFET;;§RCela n'apportera aucun effet sur l'opinion§!;;;;;;;;;;;;x
REC.2132B;;A mon suzerain;;;;;;;;;;;;x
REC.2132C;;A un vassal;;;;;;;;;;;;x
TOOLTIPREC.2132C;;Vous pouvez dorénavant réfléchir à quel vassal offrir une sculpture.;;;;;;;;;;;;x
REC.2132D;;A un membre de ma famille;;;;;;;;;;;;x
TOOLTIPREC.2132D;;Vous pouvez dorénavant réfléchir à quel membre de votre famille offrir une sculpture.;;;;;;;;;;;;x
DESCREC.2133;;A quel rang de vassal vais-je offrir une sculpture ?;;;;;;;;;;;;x
REC.2133A;;A un vassal Roi;;;;;;;;;;;;x
TOOLTIPREC.2133A;;Vous pouvez dorénavant réfléchir à quel vassal de rang Roi offrir une sculpture.;;;;;;;;;;;;x
REC.2133B;;A un vassal Duc;;;;;;;;;;;;x
TOOLTIPREC.2133B;;Vous pouvez dorénavant réfléchir à quel vassal de rang Duc offrir une sculpture.;;;;;;;;;;;;x
REC.2133C;;A un vassal Comte;;;;;;;;;;;;x
TOOLTIPREC.2133C;;Vous pouvez dorénavant réfléchir à quel vassal de rang Comte offrir une sculpture.;;;;;;;;;;;;x
REC.2133D;;A un vassal Baron;;;;;;;;;;;;x
TOOLTIPREC.2133D;;Vous pouvez dorénavant réfléchir à quel vassal de rang Baron offrir une sculpture.;;;;;;;;;;;;x
DESCREC.2134;;A quel vassal de ce rang vais-je offrir une sculpture ?;;;;;;;;;;;;x
REC.2134A;;Offrir une sculpture à ce vassal;;;;;;;;;;;;x
TOOLTIPREC.2134A;;Ce vassal recevra ma sculpture;;;;;;;;;;;;x
REC.2134B;;Offrir une sculpture à un autre vassal;;;;;;;;;;;;x
TOOLTIPREC.2134B;;Ce vassal ne recevra pas ma sculpture;;;;;;;;;;;;x
REC.2134C;;Je n'ai pas d'autre vassal de ce rang;;;;;;;;;;;;x
DESCREC.2138;;A quel membre de ma famille vais-je offrir une sculpture ?;;;;;;;;;;;;x
