L3T.0003;Choisir l'orientation du domaine -version féodale-;Choisir l'orientation du domaine -version féodale-;;;;;;;;;;;;x
NAMEL3T.0003;Feudal Demesne;Domaine Seigneurial;;;;;;;;;;;;x
DESCL3T.0003;We might choose how to developp this feudal demesne. \n\n ;Nous devons décider comment allons-nous développer ce domaine.\n\n     -Une Citadelle remplira aussi bien un rôle de poste frontière sur une de nos marches qu'un rôle de protection et de formation de troupes. C'est un site très bien défendu mais qui coûte cher à entretenir.\n     -Une Citée Fortifiée pourra abriter une population importante derrière ses hauts murs défendus par un château fort. Elle a l'étoffe d'une Capitale pour tout seigneur de notre rang !\n     -Le Bourg Féodal regroupe une communauté de paysans qui exploitent nos terres et vivent bien loin des préoccupation de la cour. Il permet l'exploitation des ressources locales, qui pourront être échangées ou vendues et... taxées pour venir remplir nos coffres.;;;;;;;;;;;;x
L3T.0003A;This will be a citadel ! Said.;Ce sera une Citadelle ! J'ai dis.;;;;;;;;;;;;x
L3T.0003B;Obviously a feudal village !;Un Bourg Féodal de toute évidence !;;;;;;;;;;;;x
L3T.0003C;Let this be a beautiful and powerfull Fortified city !;Faisons-en une belle et puissante Citée Fortifiée !;;;;;;;;;;;;x
#;;;;;;;;;;;;;;x
L3T.0004;La Commune de $HOLDING$ Choisir l'orientation du domaine -version municipale-;La Commune de $HOLDING$ Choisir l'orientation du domaine -version municipale-;;;;;;;;;;;;x
NAMEL3T.0004;City Demesne;Domaine Communal;;;;;;;;;;;;x
DESCL3T.0004;;doit se voir assigner une voie de développement. \n\n     Cette cité peut être développée soit selon une orientation production, soit à caractère commercial. Dans les deux cas, cela constitue une source non négligeable de taxation ! \n;;;;;;;;;;;;x
L3T.0004A;We might produce !;Produisons ! ;;;;;;;;;;;;x
L3T.0004B;We might trade !;Commerçons ! ;;;;;;;;;;;;x
NAMEL3T.0005;Our Beloved City;Notre Belle Cité;;;;;;;;;;;;x
L3T.0005;upgrade grande cité;upgrade grande cité;;;;;;;;;;;;x
DESCL3T.0005;This city is developping and overpasses another cape that opens news horizons.;Elle se développe et vient de franchir un nouveau cap qui lui ouvre de nouveaux horizons.;;;;;;;;;;;;x
L3T.0005A;Grow ! Grow ! Groooooooooooow !;Grandit ! Grandit ! Grandiiiiit !;;;;;;;;;;;;x
NAMEL3T.0002;Our Glorious City;Notre Glorieuse Cité;;;;;;;;;;;;x
L3T.0002;upgrade grande cité;upgrade grande cité;;;;;;;;;;;;x
DESCL3T.0002;This city is developping and overpasses another cape that opens news horizons.;Elle se développe et vient de franchir un nouveau cap qui lui ouvre de nouveaux horizons.;;;;;;;;;;;;x
L3T.0002A;Grow ! Grow ! Groooooooooooow !;Grandit ! Grandit ! Grandiiiiit !;;;;;;;;;;;;x
#;;;;;;;;;;;;;;x
L3T.0006;Choisir l'orientation du domaine -version écclésiale-;Choisir l'orientation du domaine -version écclésiale-;;;;;;;;;;;;x
NAMEL3T.0006;Clergy Lands  ;Les Terres du Clergé ;;;;;;;;;;;;x
DESCL3T.0006;Quel avenir lui réserver ? \n\n     Un Monastère constitue un conservatoire du savoir où l'on y instruit la jeunesse et compile nombre de connaissances anciennes ou nouvelles. La communauté religieuse se choisira une règle de vie monastique et pourra rejoindre un ordre monastique. \n     Une Citée Episcopale abritera les institutions religieuses locales et aura la mainmise sur les terres environnantes. \n     Une Commanderie, monastère dédié à un usage principalement militaire, assurera des troupes de qualités, notamment dans l'optique d'une guerre sainte ou juste pour mater ce prétentieux voisin !;en la province de [From.Location.GetName], quel avenir lui réserver ? \n\n     Un Monastère constitue un conservatoire du savoir où l'on y instruit la jeunesse et compile nombre de connaissances anciennes ou nouvelles. La communauté religieuse se choisira une règle de vie monastique et pourra rejoindre un ordre monastique. \n     Une Citée Episcopale abritera les institutions religieuses locales et aura la mainmise sur les terres environnantes. \n     Une Commanderie, monastère dédié à un usage principalement militaire, assurera des troupes de qualités, notamment dans l'optique d'une guerre sainte ou juste pour mater ce prétentieux voisin !;;;;;;;;;;;;x
L3T.0006A;Implantons-y un Monastère;Implantons-y un Monastère;;;;;;;;;;;;x
L3T.0006B;Laissons les à libre gestion du clergé local.;Laissons les à libre gestion du clergé local.;;;;;;;;;;;;x
L3T.0006C;Accordons donc le statut de Commanderie.;Accordons donc le statut de Commanderie.;;;;;;;;;;;;x
L3T.0007;Choisir la règle monastique du domaine de type monastère;Choisir la règle monastique du domaine de type monastère;;;;;;;;;;;;x
NAMEL3T.0007;Monastic life;Vie Monastique;;;;;;;;;;;;x
DESCL3T.0007;Quelle règle monastique ce Monastère va-t-il adopter ? \n\n Ce choix conditionnera ensuite un éventuel rattachement à l'un des ordres monastiques de la même obédience, ordres présentant chacun leurs spécifités.;Quelle règle monastique le Monastère de [From.Location.GetName] va-t-il suivre ? \n\n Ce choix conditionnera ensuite un éventuel rattachement à l'un des ordres monastiques de la même obédience, ordres présentant chacun leurs spécifités.;;;;;;;;;;;;x
L3T.0007A;Saint Benedict Rule;La Règle de Saint Benoît;;;;;;;;;;;;x
L3T.0007B;Saint Augustine Rule ;La Règle de Saint Augustin;;;;;;;;;;;;x
L3T.0007C;Saint Basil Rule;La Règle de Saint Basile;;;;;;;;;;;;x
#;;;;;;;;;;;;;;x
#ECO.0020;unrelated stuff;route Vienne - Aoste;;;;;;;;;;;;x
#DESCECO.0020;unrelated stuff;Le tracé de la principale route reliant les cités de Vienne et d'Aoste arpente nos terres puisqu'elle traverse la province de [From.Location.GetName]. Ceci nous permet de prélever quelques péages et peut-être davantage si nous investissons dans le développement de cette voie commerciale.;;;;;;;;;;;;x
#ECO.0021A;unrelated stuff;Merci pour la leçon de géographie !;;;;;;;;;;;;x
#ECO.0021;unrelated stuff;L'Axe Vienne - Aoste;;;;;;;;;;;;x
#DESCECO.0021;unrelated stuff;Le tracé de la principale route reliant les cités de Vienne et d'Aoste arpente nos terres puisqu'elle traverse la province de [From.Location.GetName]. Ceci nous permet de prélever quelques péages et peut-être davantage si nous investissons dans le développement de cette voie commerciale.;;;;;;;;;;;;x
#ECO.0021A;unrelated stuff;Merci pour la leçon de géographie !;;;;;;;;;;;;x
#ECO.0022;unrelated stuff;L'Axe Lyon - Aoste;;;;;;;;;;;;x
#DESCECO.0022;unrelated stuff;Le tracé de la principale route reliant les cités de Lyon et d'Aoste arpente nos terres puisqu'elle traverse la province de [From.Location.GetName]. Ceci nous permet de prélever quelques péages et peut-être davantage si nous investissons dans ce domaine en bonne intelligence.;;;;;;;;;;;;x
#ECO.0022A;unrelated stuff;Merci pour la leçon d'économie !;;;;;;;;;;;;x
#;;;;;;;;;;;;;;x
NAMEL3T.0010;Hello and welcome my Lord! ;Salutations Messire ! ;;;;;;;;;;;;x
L3T.0010;MAP choice;Les cartes en main !;;;;;;;;;;;;x
DESCL3T.0010;\n Please tell me what map your are playing alongside to L3T to adapt the game. ;\n Dis-moi sur quelle carte joues-tu pour adapter la partie ? ;;;;;;;;;;;;x
L3T.0010A;Some What More Historic (SWMH);Some What More Historic (SWMH);;;;;;;;;;;;x
L3T.0010B;La Couronne des Alpes (LCDA);La Couronne des Alpes (LCDA);;;;;;;;;;;;x
L3T.0010C;Vanilla;;;;;;;;;;;;;x
#;;;;;;;;;;;;;;x
DESCL3T.0101;Population grew in this province !;La population a cru autour du château. \n Les quelques maisonnées assemblées ici forment à présent un petit hameau !;;;;;;;;;;;;x
DESCL3T.0102;Population grew in this province !;Le hameau a pris de l'importance au pied du château et forme à présent un village !;;;;;;;;;;;;x
DESCL3T.0103;Population grew in this province !;Le village du château a pris de l'importance et attire toujours plus de nouveaux venus, artisans ou paysans et forme à présent un bourg !;;;;;;;;;;;;x
DESCL3T.0104;Population grew in this province !;Le bourg formé plus tôt contre le château s'est développé et atteint désormais une populatation suffisante pour porter la dénomination de ville !;;;;;;;;;;;;x
DESCL3T.0105;Population grew in this province !;Le château est désormais le coeur d'une ville suffisemmant populeuse et industrieuse pour porter le nom de cité !;;;;;;;;;;;;x
DESCL3T.0106;Population grew in this province !;La population attirée par l'essor économique a commencé à s'agglutiner pour former à présent un petit hameau !;;;;;;;;;;;;x
DESCL3T.0107;Population grew in this province !;La population attirée par l'essor économique a commencé à s'agglutiner pour former à présent un village !;;;;;;;;;;;;x
DESCL3T.0108;Population grew in this province !;La population attirée par l'essor économique a commencé à s'agglutiner pour former à présent un bourg !;;;;;;;;;;;;x
DESCL3T.0109;Population grew in this province !;La population attirée par l'essor économique a commencé à s'agglutiner pour former à présent une ville !;;;;;;;;;;;;x
DESCL3T.0110;Population grew in this province !;La population attirée par l'essor économique a commencé à s'agglutiner pour former à présent une cité !;;;;;;;;;;;;x
DESCL3T.0111;Population grew in this province !;La population a cru autour du lieu de culte et forme à présent un petit hameau !;;;;;;;;;;;;x
DESCL3T.0112;Population grew in this province !;La population a cru autour du lieu de culte et forme à présent un village !;;;;;;;;;;;;x
DESCL3T.0113;Population grew in this province !;La population a cru autour du lieu de culte et forme à présent un bourg !;;;;;;;;;;;;x
DESCL3T.0114;Population grew in this province !;La population a cru autour du lieu de culte et forme à présent une ville !;;;;;;;;;;;;x
DESCL3T.0115;Population grew in this province !;La population a cru autour du lieu de culte et forme à présent une cité !;;;;;;;;;;;;x
#;;;;;;;;;;;;;;x
DESCL3T.0015;;DESCL3T.0015 \n [From.Location.GetName];;;;;;;;;;;;x
DESCL3T.00160;;DESCL3T.00160 \n [From.Location.GetName];;;;;;;;;;;;x
DESCL3T.00161;;DESCL3T.00161 \n [From.Location.GetName];;;;;;;;;;;;x
DESCL3T.0017;;DESCL3T.0017 \n [From.Location.GetName];;;;;;;;;;;;x
DESCL3T.0018;;DESCL3T.0018 \n [From.Location.GetName];;;;;;;;;;;;x
#;;x;;;;;;;;;;;;x
XYLO.0001;Hire a forester;Embaucher un forestier;;;;;;;;;;;x;
DESCXYLO.0001;My liege, you are clearly busy with managing the affairs of your people, might I suggest a member of your court that could fill the position of Forester?;Vous êtes très occupé à diriger vos gens et vos terres, aussi je me permets de vous proposer quelqu'un de votre Cour qui pourrait convenir pour le poste de Forestier.;;;;;;;;;;;;x
XYLO.0001A;He will do nicely. Have him start immediately.;Il fera l'affaire, qu'il se présente à moi et s'attèle à la tâche.;;;;;;;;;;;;x
XYLO.0001B;If one want a job done properly...;Je le choisirais moi même.;;;;;;;;;;;;x
XYLO.0002;Forest Specialization1;Spécialisation des Forêts1;;;;;;;;;;;;x
DESCXYLO.0002;After an evaluation of our domains, our Forester informs us that the forests of [From.Location.GetName] are both able to be used for hunting or for good lumber. \n Do we need to retain it to your private hunting pleasures or open it to exploitation ?;Après un inventaire de nos domaines, notre Forestier nous informe que les bois de [From.Location.GetName] sont giboyeux et abondent d'arbres de belle stature, quel développment privilègier ? \n \nDevons-nous en réserver l'usage à sa seigneurie pour son bon plaisir de chasse ou bien les faire exploiter par nos gens ?;;;;;;;;;;;;x
XYLO.0002A;Go for a hunt !;Partons chasser !;;;;;;;;;;;;x
XYLO.0002B;Lets those lazy peasents work for us !;Faisons-la exploiter par ces fainéants de paysans !;;;;;;;;;;;;x
XYLO.0002C;Some wood, what else ?;Du bois, quoi d'autre ? ;;;;;;;;;;;;x
XYLO.0003;Forest Specialization2;Spécialisation des Forêts2;;;;;;;;;;;;x
DESCXYLO.0003;After an evaluation of our domain, our forester informs us that our forest of  [From.Location.GetName] are composed of beautiful trees that will make perfect building and artistical material. A prosperous business should be possible. Should we assume the exclusive exploitation rights?;Après inventaire et évaluation de nos domaines boisés, notre Forestier nous informe que les forêts de [From.Location.GetName] sont composées de belles futaies qui feront de bons matériaux de construction et d'artisanat. Une belle rentabilité doit pouvoir en être tirée. \n \nJe suppose que l'on va s'en arroger un droit d'exploitation exclusif ?;;;;;;;;;;;;x
XYLO.0003A;Am I greedy ? So what ?!;Moi cupide ? Et alors ?!;;;;;;;;;;;;x
XYLO.0003B;Let's be generous and leave the unprofitable activities for farmers!;Soyons généreux laissons les activités peu rentables aux paysans !;;;;;;;;;;;;x
XYLO.0004;Forest Specialization3;Spécialisation des Forêts3;;;;;;;;;;;;x
DESCXYLO.0004;After an evaluation of our domain, our forester informs us that our forest of  [From.Location.GetName] would make an excellent framework for meditation and spirituel contemplation. Should we preserve these lands for such use or should we open them up to exploitation.;Suite à notre inventaire des nos bois, notre Forestier nous informe que les forêts de [From.Location.GetName] offrent un cadre excellent pour la pratique de la méditation et de l'ermitage. \n \n Devons-nous réserver ces domaines à cet usage ou les ouvrir à l'exploitation de ressources ?;;;;;;;;;;;;x
XYLO.0004B;Glory to [Root.Religion.GetRandomGodName] !;Gloire à [Root.Religion.GetRandomGodName] !;;;;;;;;;;;;x
XYLO.0004A;These trees will be a remarkable wooden frame to enlarge the house of the Lord ... or my palace. Only god knows !;Ces arbres feront un remarquable bois charpente pour agrandir la demeure du Seigneur...ou de mon palais. Dieu seul le sait !;;;;;;;;;;;;x
XYLO.0004C;[Root.Religion.GetRandomGodName] made trees for wood isn't it ?;[Root.Religion.GetRandomGodName] a créé les arbres pour leur bois non ? ;;;;;;;;;;;;x
#;;x;;;;;;;;;;;;x
XYLO.0103;Timber sale to fill the coffers;Vente bois pour renflouer les caisses1;;;;;;;;;;;;x
DESCXYLO.0103;Our treasury is nearly empty. We could chop down some forest plots from our hunting demesne, and sell the timber to replenish the treasury.;Nos finances sont au plus bas. Nous pourrions abattre quelques parcelles de nos domaines de chasse afin de le vendre et renflouer un peu nos coffres.;;;;;;;;;;;;x
XYLO.0103A;It won't be necessary;Ce ne sera pas nécessaire.;;;;;;;;;;;;x
XYLO.0103B;Let's cut some of those.;Procédons à une coupe.;;;;;;;;;;;;x
XYLO.0104;Timber sale to fill the coffers;Vente bois pour renflouer les caisses2;;;;;;;;;;;;x
DESCXYLO.0104;We barely got enough gold to cover the bottom of our coffers. Do we need to chop down more forest plots from our hunting demesne ?;Nos finances sont toujours au plus bas. Devons nous abattre à nouveau le bois de quelques parcelles de nos domaines de chasse afin de le vendre et renflouer un peu nos coffres ?;;;;;;;;;;;;x
XYLO.0104A;Again ? No.;Encore ? Non.;;;;;;;;;;;;x
XYLO.0104B;Let's go for it.;Allons-y;;;;;;;;;;;;x
XYLO.0105;Timber sale to fill the coffers;Vente bois pour renflouer les caisses3;;;;;;;;;;;;x
DESCXYLO.0105;Our gold reserves is still hardly fit for a lord. Do we need to chop down more forest plots from our hunting demesne ?;Nos finances sont toujours au plus bas. Devons nous abattre à nouveau le bois de quelques parcelles de nos domaines de chasse afin de le vendre et renflouer un peu nos coffres ?;;;;;;;;;;;;x
XYLO.0105A;Again ? No.;Encore ? Non.;;;;;;;;;;;;x
XYLO.0105B;Let's go for it.;Allons-y;;;;;;;;;;;;x
XYLO.0106;To deforest a forest;La coupe de trop;;;;;;;;;;;;x
DESCXYLO.0106;Cutting down so many trees to fill our coffers has led to dramatic reduction in the foilage… We will probably soon have to halt most of our activites….;Couper autant d'arbres pour renflouer nos caisses a conduit à une réduction dramatique de la couverture forestière... Nous allons probalement devoir cesser bientôt un certain nombre de nos activités...;;;;;;;;;;;;x
XYLO.0106A;That is to say ?;C'est à dire ?;;;;;;;;;;;;x
XYLO.0107;;;;;;;;;;;;;;x
DESCXYLO.0107;;Au regard de notre niveau de piété, et puisque nous en aurions la possibilité, nous pourrions faire don d'une partie de nos bois à l'Eglise. \nCela serait bénéfique pour le salut de notre âme et la réputation de notre famille.;;;;;;;;;;;;x
XYLO.0107A;;Allons-y;;;;;;;;;;;;x
XYLO.0107B;;L'enjeu me semble trop faible;;;;;;;;;;;;x
XYLO.0107C;;Et si nous essayions d'en retirer quelques profits ?;;;;;;;;;;;;x
XYLO.0108;;;;;;;;;;;;;;x
DESCXYLO.0108;;Nos forêts sont grandes et nous pourrions en céder une partie à l'Eglise. \nCela serait bon pour le salut de notre âme et renforcerait notre très sainte Mère l'Eglise.;;;;;;;;;;;;x
XYLO.0108A;;Pour le salut de notre âme !;;;;;;;;;;;;x
XYLO.0108B;;Je trouverai d'autres moyens;;;;;;;;;;;;x
XYLO.0108C;;Et contre quelque or ?;;;;;;;;;;;;x
#;;x;;;;;;;;;;;;x
XYLO.0201;;Achat v1;;;;;;;;;;;x;
DESCXYLO.0201;The treasury is brimming with coin. Expanding our forest domain could be an attractive investment opportunity. Should some of the gold be used to grow our woodland demesne?;Nos coffres débordent d'or. Agrandir nos possessions forestières peut être une option d'investissement intéressante. Souhaitez-vous investir quelque or dans cette voie ?;;;;;;;;;;;;x
XYLO.0201A;Trees... that must be a safe investment right ? Let's give it a shot.;Tentons cela.;;;;;;;;;;;;x
XYLO.0201B;Come back tomorrow.;Repassez demain.;;;;;;;;;;;;x
XYLO.0201C;Treasury filling up ?! Speak sense your imbecile ! There will be no wasting my money on silly plants.;Débordent, débordent, c'est vite dit. Non.;;;;;;;;;;;;x
XYLO.0202;;Achat v2;;;;;;;;;;;x;
DESCXYLO.0202;We have a lot of excess gold lying about, should some of it be put to work enlarging our woodland industry?;Nos coffres débordent d'or. Agrandir nos possessions forestières peut être une option d'investissement intéressante. Souhaitez-vous investir quelques pièces dans cette voie ?;;;;;;;;;;;;x
XYLO.0202A;Seems sensible.;Allons-y.;;;;;;;;;;;;x
XYLO.0202B;Not tonight, my head is hurting.;Pas ce soir, j'ai mal à la tête.;;;;;;;;;;;;x
XYLO.0202C;Excess gold ? Such a thing does not exist.;Débordent ? Qui prétend cela ? Non.;;;;;;;;;;;;x
XYLO.0203;;Achat v3;;;;;;;;;;;x;
DESCXYLO.0203;-Our coffers are teeming with gold, maybe it would be advisable to spend some of it on forest plots ?;Nos coffres débordent d'or. Agrandir nos possessions forestières peut être une option d'investissement intéressante. Souhaitez-vous investir quelques pièces dans cette politique ?;;;;;;;;;;;;x
XYLO.0203A;I like to see my money grow, let's put it to good use.;Cela me paraît un bon investissement.;;;;;;;;;;;;x
XYLO.0203B;Let me think it over.;Je dois réfléchir.;;;;;;;;;;;;x
XYLO.0203C;-Unless you have found a new lord to advice, I would advise you to lookup -no- in the dictionary.;N'ai-je pas déjà dit non ?;;;;;;;;;;;;x
XYLO.0302;forest charter related stuff;RR foret;;;;;;;;;;;;x
DESCXYLO.0302;;En nous réservant presque l'exclusivité des droits d'exploitation de nos forêts, cela crée un mécontentement croissant parmi la population. Nous pourrions par exemple accorder une licence forestière pour une courte durée durée afin de calmer les vélléités des villageois dans la province de [From.Location.GetName].;;;;;;;;;;;;x
XYLO.0302A;;Il nous faut agir avant que ça ne dégénère.;;;;;;;;;;;;x
XYLO.0302B;;Faisons un geste.;;;;;;;;;;;;x
XYLO.0302C;And ? ;Et alors ?;;;;;;;;;;;;x
XYLO.0303;;RR général + foret;;;;;;;;;;;;x
DESCXYLO.0303;;La révolte gronde en [From.Location.GetName] ! L'exploitation de la forêt à vos seules fins semble être l'un des objets des revendications et qui vient s'ajouter à d'autres causes. Relâcher un peu de pression pendant un temps sur ce point en proposant un licence forestière pourrait calmer la population.;;;;;;;;;;;;x
XYLO.0303A;;Soyons efficace, et dans la durée !;;;;;;;;;;;;x
XYLO.0303B;;Tentons cela pour le moment.;;;;;;;;;;;;x
XYLO.0303C;;Ce n'est pas la cause principale.;;;;;;;;;;;;x
XYLO.0304;;demande d'upgrade de la licence;;;;;;;;;;;;x
DESCXYLO.0304;;Les villageois prétendent peiner à survivre car ils ne peuvent profiter que d'une trop infime part des richeses de la forêt. Ils implorent votre bonté pour l'octroi d'une charte leur ouvrant des droits supplémentaires sur la forêt de [From.Location.GetName]. Que décidez-vous ?;;;;;;;;;;;;x
XYLO.0304A;Granted;Accordé.;;;;;;;;;;;;x
XYLO.0304B;I govern !;JE gouverne !;;;;;;;;;;;;x
XYLO.0305;;demande d'upgrade de la licence;;;;;;;;;;;;x
DESCXYLO.0305;;La licence forestière accordée ne suffit pas au peuple de [From.Location.GetName]. Il est toujours inquiet des restrictions qui persistent, il demande une charte lui garantissant plus de droits et sur une plus longue durée. Que faisons-nous ?;;;;;;;;;;;;x
XYLO.0305A;Granted;Accordé.;;;;;;;;;;;;x
XYLO.0305B;;Nous ne pouvons nous le permettre.;;;;;;;;;;;;x
XYLO.0305C;;Supprimons la charte existante ça leur apprendra !;;;;;;;;;;;;x
#;;x;;;;;;;;;;;;x
#;;EVENTS BANDITS;;;;;;;;;;;;x
#;;x;;;;;;;;;;;;x
EVTDESC68001;The peasants of [Root.GetName] are slowly starting to respect my rule again. I should keep my demesne small enough to manage.;Les paysans de [Root.GetName] recommencent progressivement à respecter mon autorité. Je devrais maintenir mon domaine à une taille gérable.;;;;;;;;;;;;x
EVTDESC68010;Due to my somewhat lacking Stewardship skill, a Thieves' Guild has been established in [Root.GetName].;Mon inaptitude pour l’intendance a entraîné l’établissement d’une Guilde de voleurs à [Root.GetName].;;;;;;;;;;;;x
EVTDESC68020;My less than perfect Diplomacy has allowed a Smugglers' Ring to appear in [Root.GetName].;Mes piètres talents de diplomate ont permis à un Cercle de contrebandiers de se créer à [Root.GetName].;;;;;;;;;;;;x
EVTDESC68030;Due to my mediocre understanding of Martial matters, bands of robbers are roaming the countryside in [Root.GetName]. They are too craven to attack my castles though.;À cause de mon manque de discernement dans le domaine martial, des bandes de voleurs sillonnent les campagnes de [Root.GetName]. Ils sont cependant trop lâches pour attaquer mes châteaux.;;;;;;;;;;;;x
#;;x;;;;;;;;;;;;x
raids_pirates;Pirates' raids;Raids pirates;;;;;;;;;;;;x
raids_pirates_desc;;Les raids des pirates ici sont réguliers. Face à l'inefficacité et l'impuissance du Seigneur ils prospèrent et ont probablement établi domicile non loin de là.;;;;;;;;;;;;x
XYLO.02101;;établissement des pirates;;;;;;;;;;;;x
DESCXYLO.02101;Due to our incapacity to rule so much lands, a band of pirates freely terrorize the coasts of [From.Location.GetName];Nous avons bien trop de terres à gérer... surtout au reagrd de nos compétences et notre incapacité à y maintenir l'ordre. Voilà une situation en or pour les roublards de tous poil ! Notamment semble-t-il cette bande de pirates qui sévit depuis quelques temps déjà et lancent des raids de plus en plus audacieux sur les côtes de [From.Location.GetName].;;;;;;;;;;;;x
XYLO.02101A;Gottferdom ! ;Gottferdom ! ;;;;;;;;;;;;x
XYLO.02101B;;Sacrebleu ! ;;;;;;;;;;;;x
XYLO.02102;;suppression des pirates;;;;;;;;;;;;x
DESCXYLO.02102;Pirates' raids ends in [From.Location.GetName].;En retrouvant un Domaine à la mesure de ce que nous pouvions maintenir en ordre et au prix d'une lutte longue et acharnée, nous avons finalement pu regagner le contrôle de nos terres et éradiquer les pirates qui ravageaient les côtes de [From.Location.GetName].;;;;;;;;;;;;x
XYLO.02102A;Il était temps !;Il était temps !;;;;;;;;;;;;x
DESC00401;;Sortis de nul part, un groupe de bandits nous attaquent ! \n Personne ne m'avait-il conseillé de m'occuper de la prolifération des bandits sur nos terres ? ;;;;;;;;;;;;x;
XYLO.04013A;They are few enough to defeat alone..;Ils ne sont pas nombreux, je peux les vaincre seul...;;;;;;;;;;;;x;
XYLO.04013B;Charge!;Chargez !;;;;;;;;;;;;x;
XYLO.0401C;Pay them .;Payer-les.;;;;;;;;;;;;x;
bandits_installes;Well settlef bandits;Bandits bien installés;;;;;;;;;;;;x
bandits_installes_desc;;Les voleurs, malandrins et autres bandes d'affreux ce sont installés durablement sur ces terres, s'affairant à leurs viles activités et avec des conséquences désastreuses.;;;;;;;;;;;;x
chef_malandrin;Bandit leader;Meneur de bandits;;;;;;;;;;;;x
chef_malandrin_desc;Bandits in [From.Location.GetName] are now installed for some times and tend to reinforce. Maybe it is time to act against them ?;Ce personnage est à la tête d'une bande de malfrats toujours plus influants pillant et volant dans la région. Il serait peut être temps de s'en débarrasser non ?;;;;;;;;;;;;x
XYLO.0211;;renforcement des bandits;;;;;;;;;;;;x
DESCXYLO.0211;;Les bandits qui terrorisent la campagne et pertubent le commerce sont à présent installés depuis un certain temps dans la région de [From.Location.GetName]. \nPeut-être faudrait-il tenter de les disperser avant que la situation ne s'aggrave ?;;;;;;;;;;;;x
XYLO.0211A;War is raging, there is nothing we can do;La guerre fait rage, nous ne pouvons rien faire;;;;;;;;;;;;x
XYLO.0211B;Let's decide what to do.;Décidons au plus vite de ce qu'il convient de faire.;;;;;;;;;;;;x
reunir_le_conseil;Convocate the Council;Nous réunissons le Conseil afin de prendre une décision.;;;;;;;;;;;;x
XYLO.0212;send a councilor;envoyer un conseiller;;;;;;;;;;;;x
DESCXYLO.0212;How will we try to eliminate the bandits that terrorize [From.Location.GetName];Au regard de la situation, par quel moyen pourrions-nous nous débarrasser de ces bandits qui empoisonnent l'économie et la vie de nos gens de la région de [From.Location.GetName] ?;;;;;;;;;;;;x
XYLO.0212A;Try negociating;Tentons de négocier;;;;;;;;;;;;x
